認證編號,實驗室名稱,實驗室地址,實驗室電話,實驗室網站,通過日期,認證項目,公告資訊名稱,公告資訊連結,認證證書連結
001,財團法人食品工業發展研究所(檢驗技術研發及服務中心),30062新竹市東區食品路331號,(03) 5223191,http://www.firdi.org.tw/2/2-1.htm,103.06.26,水分、粗灰分、粗脂肪、粗蛋白、粗纖維、著色劑、咖啡因、酸度、酸價、皂化價、過氧化價、碘價、糖度、維生素A、B1、B2、B12、E、葉酸、過氧化氫、二氧化硫(食品)、二氧化硫(免洗筷)、沙門氏桿菌、仙人掌桿菌、單核球增多性李斯特菌、乙型受體素類、氯黴素類、脂肪酸、順丁烯二酸、防腐劑,衛生福利部103年06月26日部授食字第1031103047號,http://www.fda.gov.tw/TC/includes/GetFile.ashx?mID=133&id=30381&chk=d43d2b9d-e6b1-4d68-a630-90b063963f27,http://www.fda.gov.tw/TC/includes/GetFile.ashx?mID=133&id=18940&chk=3d7ffdea-8ed1-4fc3-9b6c-abaf2bb7e18a
002,台灣檢驗科技股份有限公司,,,,,,,,
(食品實驗室-台北),24886新北市五股區新北產業園區五工路125號,(02) 2299-3279,http://www.tw.sgs.com/zh_tw/home_tw_v2?,103.11.21,水分、粗灰分、粗脂肪、甲醛、甲基汞、重金屬(以Pb計)、乙型受體素類、二氧化硫(食品)、抗氧化劑、三聚氰胺、三聚氰酸、咖啡因、塑化劑、橘黴素、赭麴毒素A、棒麴毒素、黃麴毒素、卡巴得及其代謝物、抗原蟲劑、動物用藥-多重殘留分析、殘留農藥(二)、(四)、氯黴素類、孔雀綠及其代謝物、硝基呋喃代謝物、丙酸、亞硝酸鹽、四環黴素類、硼酸及其鹽類、過氧化氫(食品)、防腐劑、甜味劑、無機砷(水產品)、順丁烯二酸、3-單氯丙二醇、水產動物類重金屬(鉛、鎘)、-內醯胺類抗生素、生菌數、大腸桿菌群、大腸桿菌、金黃色葡萄球菌、黴菌及酵母菌、仙人掌桿菌、沙門氏桿菌、食品中磷酸鹽,衛生福利部103年11月21日部授食字第1031105861號,http://www.fda.gov.tw/TC/includes/GetFile.ashx?mID=133&id=32920&chk=df1bfdd0-3561-4df2-b650-49cd454fa66c,http://172.16.0.45/upload/133/2013122314120915261.pdf,
003,全國公證檢驗股份有限公司(化學與微生物實驗室),11492台北市內湖區瑞光路423號8樓,(02)6602-2888,http://www.intertek-twn.com/big5/news/index_news.asp?page_id=7&project_code=0,103.12.30,水分、粗灰分、粗脂肪、粗蛋白、二氧化硫(食品)、糖類、總糖、果糖酸、還原糖、礦物質(鈣、銅、鐵、鎂、錳、磷、鉀、鈉、鋅)、橘黴素、棒麴毒素、黃麴毒素、重金屬(以Pb計)、維生素A、C、甜味劑、甲醛、乙型受體素類、孔雀綠及其代謝產物、塑化劑、著色劑、防腐劑、抗氧化劑、三聚氰胺及三聚氰酸、壬基苯酚及壬基苯酚聚乙氧基醇、溴酸鹽、過氧化氫(食品)、過氧化氫(免洗筷)、硝基喃代謝物、氯黴素類、丙酸、殘留農藥(二)、(四)、二氧化硫(免洗筷)、硼酸及其鹽類、生菌數、大腸桿菌、大腸桿菌群、金黃色葡萄球菌、沙門氏桿菌、仙人掌桿菌、病原性大腸桿菌、腸炎弧菌、黴菌及酵母菌、單核球增多性李斯特菌、李斯特菌(乳品)、大腸桿菌O157：H7、阪崎腸桿菌、志賀氏桿菌、溶出試驗(鉛、鎘、砷、鋅、銻、鍺)、溶出試驗(雙酚A)、溶出試驗(以Pb計)、耐熱試驗(包材)、著色劑(包材)、螢光增白劑(包材)、溶出試驗(高錳酸鉀消耗量、甲基丙烯酸甲酯單體、酚、氯仿可溶物、蒸發殘渣、氯甲代環氧丙烷單體、氯乙烯單體、總乳酸、己內醯胺單體、甲醛)、砷之檢驗(以As2O3計)、材質鑑別、材質試驗(二丁錫化物、鉛、鎘、氯乙烯單體、聚偏二氯乙烯單體、2-巰基咪唑啉、鋇)、動物用藥-多重殘留分析(二)、包裝飲用水中重金屬(鉛、鎘、銅、鋅、砷、汞)、食用油脂中重金屬(砷、鉛、銅、汞)、水產動物類中重金屬(鉛、鎘)、蔬果類中重金屬(鉛、鎘)、飲料類中重金屬(鉛、砷、銅、錫、銻)、甲基汞(二)、包裝飲用水中糞便性鏈球菌、包裝飲用水中綠膿桿菌、順丁烯二酸、溶出試驗(三聚氰胺)、3-單氯丙二醇、銅葉綠素、食品中脂肪酸、材質試驗(苯乙烯、甲苯、乙苯、正丙苯、異丙苯)、赭麴毒素A、溶出試驗(DBP、DEHP、BBP、DEHA、DINP、DIDP)、食品中磷酸鹽、殘留農藥-(五),衛生福利部103年12月30日部授食字第1031106594號,http://www.fda.gov.tw/TC/includes/GetFile.ashx?mID=133&id=33644&chk=6a269210-a941-4433-9d87-861c6ebadc14,http://www.fda.gov.tw/TC/includes/GetFile.ashx?mID=133&id=5722&chk=87041daa-8fda-40d1-9ff7-8879a6137c28
004,財團法人台北市瑠公農業產銷基金會(農業檢驗中心),23141新北市新店區民權路50號4樓,(02) 2915-8703,http://www.liukung.org.tw/index7t.asp,104.01.13,黃麴毒素、殘留農藥-(四),衛生福利部104年01月13日部授食字第1041100078B號,http://www.fda.gov.tw/TC/includes/GetFile.ashx?mID=133&id=33927&chk=7f9f92f4-5874-48a3-a04e-6466eb10151f,http://172.16.0.45/upload/133/2014010314110491564.pdf
005,台美檢驗科技有限公司(檢驗中心),24889新北市新莊區五股工業區五工五路21號,(02) 2298-1370,http://www.superlab.com.tw/,104.01.13,水分、粗灰分、粗脂肪、粗蛋白、礦物質-鈉、揮發性鹽基態氮、兒茶素、丙酸、糖類、Monacolin K、亞硝酸鹽、黴菌及酵母菌、抗生物質、單核球增多性李斯特菌、曲狀桿菌、耶辛尼氏腸炎桿菌、阪崎腸桿菌、霍亂弧菌、志賀氏桿菌、產氣莢膜桿菌、氣單胞菌、金黃色葡萄球菌、大腸桿菌O157：H7、黃麴毒素、赭麴毒素 A、棒麴毒素、橘黴素、三聚氰胺及三聚氰酸、過氧化氫、防腐劑、塑化劑、維生素 E、著色劑、硼酸、生菌數、大腸桿菌群、仙人掌桿菌、腸炎弧菌、乳酸菌、過氧化氫(免洗筷)、二氧化硫(免洗筷)、維生素C、氯黴素類、植物性成分-芒果、花生、動物性成分-金絲燕、冬蟲夏草、蛹蟲草、牛樟芝,衛生福利部103年08月27日部授食字第1031104062B號,http://www.fda.gov.tw/TC/includes/GetFile.ashx?mID=133&id=33926&chk=016a5592-bea6-475b-8b7b-b1e2b18e14fe,
006,味全食品工業股份有限公司(中央研究所 分析檢驗中心),22102新北市汐止區新台五路一段98號15樓,(02) 2696-7969,http://www.arch-world.com.tw/Company/19415.html,102.11.22,灰分、水分、固形物、蛋白質、維生素C、酸度、粗脂肪、羥甲胺基氮,衛生福利部食品藥物管理署102年11月22日部授食字第1021151393號,http://172.16.0.45/upload/133/2013112715471337031.pdf,http://172.16.0.45/upload/133/2013120315501343517.pdf
007,台灣檢驗科技股份有限公司(超微量工業安全實驗室),24886新北市五股工業區五工路136-1號,(02) 2299-3279,http://www.tw.sgs.com/zh_tw/home_tw_v2?,103.10.16,食用油脂中重金屬-砷、鉛、銅、汞、食用菇類重金屬,,,
(鉛、鎘)、橘黴素、Monacolin K、水產動物類中重金屬(鉛、鎘)、正己烷,衛生福利部103年10月16日部授食字第1031105068號,http://www.fda.gov.tw/TC/includes/GetFile.ashx?mID=133&id=32044&chk=fed3b022-9b68-4e2b-8092-a3d4895e14ef,http://www.fda.gov.tw/TC/includes/GetFile.ashx?mID=133&id=5932&chk=7a9a1bdd-2a2d-4e7a-8191-52314c450c6a,,,,,,
008,暐凱國際檢驗科技股份有限公司(食品安全檢驗中心),114台北市內湖區內湖路1段120巷15弄28號,(02) 8751-1232,http://www.fsii.com.tw/,103.06.04,孔雀綠及其代謝物、三聚氰胺、硼酸及其鹽類、過氧化氫、沙門氏桿菌、金黃色葡萄球菌、單核球增多性李斯特菌、大腸桿菌O157：H7、乙型受體素類、食用菇類重金屬(鉛、鎘)、順丁烯二酸、腸炎弧菌、黴菌及酵母菌,衛生福利部103年06月04日部授食字第1031102676號,http://www.fda.gov.tw/TC/includes/GetFile.ashx?mID=133&id=30082&chk=de3f523e-d2af-482e-8706-58027d81595b,http://www.fda.gov.tw/TC/includes/GetFile.ashx?mID=133&id=391&chk=3f676c47-ba53-49f7-818b-dcc1e7d9a68f
010,財團法人中央畜產會(技術服務中心),90049屏東縣屏東市工業五路2號,(08) 723-0341,http://service-center.naif.org.tw/skel.htm,103.12.30,生菌數、大腸桿菌群、仙人掌桿菌、病原性大腸桿菌、黴菌及酵母菌、腸炎弧菌、金黃色葡萄球菌、曲狀桿菌、大腸桿菌(O157:H7)、乳酸菌、霍亂弧菌、阪崎腸桿菌、產氣莢膜桿菌、動物性成分-定性篩選、動物性成分-豬、羊、雞、火雞、鴕鳥、牛、植物性成分-蔥、蒜、洋蔥、韭、蕎、抗生物質、水分、粗灰分、乳脂肪、粗脂肪、粗蛋白、澱粉、膽固醇、水解胺基酸、磷酸鹽、游離脂肪酸、水分活性測定、過氧化價、孔雀綠及其代謝物、乙型受體素類、硝基呋喃代謝物、黃麴毒素、橘黴素、動物用藥-多重殘留分析(二)、四環黴素類、亞硝酸鹽、過氧化氫、防腐劑、卡巴得及其代謝物、抗原蟲劑、-內醯胺類抗生素、殘留農藥(二)、(四)、水產動物類中重金屬(鉛、鎘)、甲基汞、抗生素及其代謝物、兒茶素、魚油中EPA、DHA、Monacolin K、離子型抗球蟲藥、包裝飲用水中大腸桿菌群、大腸桿菌、沙門氏桿菌、乳品李斯特菌、單核球增多性李斯特菌、包裝飲用水中糞便性鏈球菌、包裝飲用水中綠膿桿菌、氯黴素類,衛生福利部103年12月30日部授食字第1031106595號,http://www.fda.gov.tw/TC/includes/GetFile.ashx?mID=133&id=33645&chk=20ca887a-41f5-42d3-bd29-7e8a00b9ef73,http://www.fda.gov.tw/TC/includes/GetFile.ashx?mID=133&id=22514&chk=7229fbba-e91f-4691-b600-fd093a0ff58e
012,國立成功大學環境微量毒物研究中心(超微量物質分析實驗室),70403台南市勝利路138號,(06) 235-3535,http://rcetts.rsh.ncku.edu.tw/bin/home.php,103.11.28,戴奧辛(肉類、乳品類、蛋類、魚貝類、油脂類、蔬菜類)、多氯聯苯(肉類、乳品類、蛋類、魚貝類、油脂類、蔬菜類),衛生福利部食品藥物管理署103年11月28日部授食字第1030050094A號,http://www.fda.gov.tw/TC/includes/GetFile.ashx?mID=133&id=33077&chk=d9969bc3-d3e7-46e0-9ed0-190b8ea41f92,http://www.fda.gov.tw/TC/includes/GetFile.ashx?mID=133&id=33088&chk=e171b047-b473-4f51-9b79-29e026e17a37
013,仲禹工程顧問股份有限公司(環境暨超微量分析實驗室),40850台中市南屯區工業24路32號4樓,(04) 2350-1158,http://www.worthies.com.tw/service_dioxin.htm,103.11.21,戴奧辛(乳品類、肉類、魚貝類、蛋類、油脂類)、多氯聯苯(乳品類、肉類、魚貝類、蛋類、油脂類),衛生福利部103年11月21日部授食字第1031105858號,http://www.fda.gov.tw/TC/includes/GetFile.ashx?mID=133&id=32919&chk=5f21ebf2-e226-4b7d-bfed-654be021ff3d,http://www.fda.gov.tw/TC/includes/GetFile.ashx?mID=133&id=32919&chk=5f21ebf2-e226-4b7d-bfed-654be021ff3d
014,杜夫萊茵股份有限公司(高雄實驗室),806高雄市前鎮區南七路3號3樓,(07)831-7000 轉111,http://www.aimex.tw/index02.asp#,103.09.24,防腐劑、抗氧化劑、硼酸及其鹽類、過氧化氫、甜味劑、氯黴素類、硝基夫喃代謝物、金黃色葡萄球菌、包裝飲用水中綠膿桿菌、糞便性鏈球菌、大腸桿菌群、孔雀綠及其代謝物、生菌數、大腸桿菌、大腸桿菌群、沙門氏桿菌、黴菌及酵母菌、水分、粗灰分、粗蛋白、順丁烯二酸,衛生福利部103年09月24日部授食字第1031104638號,http://www.fda.gov.tw/TC/includes/GetFile.ashx?mID=133&id=31656&chk=6e63b861-f7d8-4e08-824a-221236541296,http://www.fda.gov.tw/TC/includes/GetFile.ashx?mID=133&id=24181&chk=60c30438-4d4e-4123-8988-fd87c06f976c
015,上準環境科技股份有限公司(食品衛生實驗室),40768台中市西屯區工業區三十六路41號,(04) 2358-2525,http://www.sundream.com.tw,103.11.21,硝基呋喃代謝物、四環黴素類、孔雀綠及其代謝物、三聚氰胺、油脂中重金屬(砷、鉛、銅、汞)、包裝飲用水中重金屬(砷、鉛、鎘、銅、鋅、汞)、水產動物類重金屬(鉛、鎘)、過氧化氫(食品)、過氧化氫(免洗筷)、硼酸及其鹽類、順丁烯二酸、動物用藥-多重殘留分析(二)、鄰苯二甲酸酯類、食米重金屬(鉛、鎘、汞)、食用菇類重金屬(鉛、鎘),衛生福利部103年11月21日部授食字第1031105855號,http://www.fda.gov.tw/TC/includes/GetFile.ashx?mID=133&id=32921&chk=40dee98c-ed91-4558-a46f-664f28101c81,http://www.fda.gov.tw/TC/includes/GetFile.ashx?mID=133&id=5922&chk=176858c8-59cd-4892-9955-71a372fbd0f0
016,台灣檢驗科技股份有限公司(食品實驗室-高雄),81170高雄市楠梓加工出口區開發路61號,(07) 301-2121,http://www.tw.sgs.com/zh_tw/home_tw_v2?,103.09.24,生菌數、大腸桿菌群、糞便性鏈球菌、綠膿桿菌、腸炎弧菌、仙人掌桿菌、病原性大腸桿菌、大腸桿菌、黴菌及酵母菌、乳品中李斯特菌、阪崎腸桿菌、金黃色葡萄球菌、沙門氏桿菌、水分、粗灰分、粗脂肪、粗蛋白、酸價、總極性物質、膳食纖維、糖類(葡萄糖、果糖、蔗糖、麥芽糖、乳糖)、氯黴素類、硝基喃代謝物、孔雀綠及其代謝物、防腐劑、丙酸、動物性成分-定性篩選、動物性成分-豬、羊、雞、牛、食品中植物性成分-蔥、洋蔥、韭菜、蒜、蕎、乙型受體素類、四環黴素類、動物用藥-多重殘留分析(二)、防腐劑、色素、礦物質(鈣、銅、鐵、鎂、錳、磷、鉀、鈉、鋅)、水產動物類重金屬(鉛、鎘)、食用油脂重金屬(砷、鉛、銅、汞)、硼酸及其鹽類、水分含量(蜂蜜)、水不溶物含量(蜂蜜)、澱粉酶活性(蜂蜜)、羥甲基糠醛(蜂蜜)、維生素A、C、咖啡因、酸度、塑化劑、甜味劑、乳酸菌、維生素D、順丁烯二酸、組織胺、揮發性鹽基態氮、膽固醇、動物性成分-金絲燕、鹿、單核球增多性李斯特菌,衛生福利部103年09月24日部授食字第1031104636號,http://www.fda.gov.tw/TC/includes/GetFile.ashx?mID=133&id=31655&chk=ce29e1eb-0e2f-4e9c-a768-9ad76441531b,
018,昭信標準檢驗股份有限公司(藥物化學檢測實驗室),24355新北市泰山區明志路3段517號6樓,(02) 2906-4369,http://www.theosin.com.tw/theosin/index2.php,103.05.01,水分、灰分、魚油中EPA、DHA、Monacolin K,衛生福利部103年05月01日部授食字第1031102039號,http://www.fda.gov.tw/TC/includes/GetFile.ashx?mID=133&id=29573&chk=5f6514ed-7a26-4fa5-827d-6a4d4fc11ec6,http://www.fda.gov.tw/TC/includes/GetFile.ashx?mID=133&id=18678&chk=0d343e13-559a-4067-b053-c77e0447ea99
020,愛之味股份有限公司(健康科學研究所檢驗分析中心),62152嘉義縣民雄鄉頭橋工業二路11號,(05) 221-1521,http://agvcn.cn.alibaba.com/,103.01.17,水分、粗蛋白、粗灰分、礦物質(鋅、銅、鐵、鈉、鈣)、粗脂肪、過氧化氫、膳食纖維、防腐劑、生菌數、大腸桿菌群、大腸桿菌、順丁烯二酸、食用菇類重金屬(鉛、鎘),衛生福利部食品藥物管理署103年01月17日FDA風字第1031100194號,http://172.16.0.45/upload/133/2014012409481092650.pdf,http://172.16.0.45/upload/133/2014012411211631827.pdf
021,國立成功大學-永續環境實驗所(藥物毒物分析實驗室),709台南市安南區安明路三段500號,(06) 384-0136,http://serc.ncku.edu.tw/index.php?lang=cht,103.01.22,殘留農藥(四),衛生福利部食品藥物管理署103年01月22日FDA風字第1031100285號,http://172.16.0.45/upload/133/2014012409543037394.pdf,http://172.16.0.45/upload/133/2014012411205864383.pdf
022,台灣區鰻蝦輸出業同業公會(水產品檢驗中心),33757桃園縣大園鄉圳頭村6鄰30號,(03) 385-4645,http://www.apic.org.tw/,103.10.13,孔雀綠及其代謝物、硝基呋喃代謝物,衛生福利部103年10月13日部授食字第1031104974B號,http://www.fda.gov.tw/TC/includes/GetFile.ashx?mID=133&id=32047&chk=1fffaf2c-229c-41c5-8ac3-7223aeba827e,http://www.fda.gov.tw/TC/includes/GetFile.ashx?mID=133&id=21646&chk=3d2b651b-e84c-4ff6-81c3-2d6c9b822bb6
023,統一企業股份有限公司(永康品管課),71001台南市永康區中正路301號,(06) 253-6789,http://www.uni-president.com.tw/,102.01.02,生菌數、大腸桿菌、大腸桿菌群、仙人掌桿菌、金黃色葡萄球菌,行政院衛生署102年01月02日署授食字第1011103293號,http://www.fda.gov.tw/TC/includes/GetFile.ashx?mID=133&id=22226&chk=b7fdb167-7169-4406-94bc-a151690bee75,http://www.fda.gov.tw/TC/includes/GetFile.ashx?mID=133&id=22289&chk=f03087e5-eb94-4c5a-9599-40a98e5c2c73
024,財團法人中華穀類食品工業技術研究所(化驗組實驗室),24937新北市八里區下罟子十二之六號,(02) 2610-1010,http://www.cgprdi.org.tw/,103.03.12,濕麵筋、黃麴毒素、硼酸及其鹽類、丙酸、防腐劑、木糖醇、赭麴毒素A、水分、粗灰分、順丁烯二酸,衛生福利部103年03月12日部授食字第1031101063號,http://www.fda.gov.tw/TC/includes/GetFile.ashx?mID=133&id=28948&chk=5dcda9c6-c40c-4667-ab4c-5607a97cfd76,http://www.fda.gov.tw/TC/includes/GetFile.ashx?mID=133&id=5728&chk=e1be81f1-4cf2-417c-8eb5-ee586a1186c1
025,正修科技大學超微量研究科技中心(環境檢驗實驗室),833高雄市鳥松區澄清路840號,(07) 731-0606,http://www2.csu.edu.tw/csitshow/micro/index-1.htm,102.05.08,戴奧辛及多氯聯苯(肉類、乳品類、蛋類、魚貝類、油脂類),行政院衛生署102年05月08日署授食字第1021101361號,http://www.fda.gov.tw/TC/includes/GetFile.ashx?mID=133&id=23692&chk=8372524d-ff8b-4e68-a6b9-96e42972f45a,http://www.fda.gov.tw/TC/includes/GetFile.ashx?mID=133&id=5923&chk=1f7a81a9-3827-44d6-9448-99c80a9e2514
026,弘光科技大學(食品與化妝品品質檢驗與分析中心),433台中市沙鹿區中棲路34號,(04) 2631-8652,http://web.hk.edu.tw/~tacfc/index.files/options_basic_7.html,102.08.22,食品中動物性成分-定性篩選、食品中動物性成分之定性(雞、牛、羊、魚、豬)、食品中植物性成分之定性(洋蔥、韭、蕎、蔥、蒜)、硼酸及其鹽類、諾羅病毒、沙波病毒、A型肝炎病毒,衛生福利部食品藥物管理署102年08月22日FDA風字第1021150243號,http://www.fda.gov.tw/TC/includes/GetFile.ashx?mID=133&id=25040&chk=96cddedb-0766-4122-b0fc-9dc640e03aa0,http://www.fda.gov.tw/TC/includes/GetFile.ashx?mID=133&id=5924&chk=ebd62c95-94d0-4394-9f71-fb8c82c79992
027,華友科技顧問股份有限公司(藥物食品化粧品檢驗實驗室),24255新北市新莊區中正路610號2F,(02) 2906-0887,http://www.hwayo.com.tw/,103.12.30,防腐劑、順丁烯二酸、咖啡因,衛生福利部103年12月30日部授食字第1031106588號,http://www.fda.gov.tw/TC/includes/GetFile.ashx?mID=133&id=33643&chk=18064bde-7d6d-40ce-a6f1-f996a6d35d4f,http://www.fda.gov.tw/TC/includes/GetFile.ashx?mID=133&id=1796&chk=d6b3e304-021a-42f6-9fdc-658f6f4f3de7
029,台灣檢驗科技股份有限公司(化學實驗室-台北),24886新北市新北產業園區五權路33號,(02) 2299-3279 ,http://www.tw.sgs.com/zh_tw/home_tw_v2,103.06.27,礦物質(鈉)、材質試驗(鉛、鎘)、溶出試驗(鉛、鎘)、雙酚A、溶出試驗(高錳酸鉀消耗量)、溶出試驗(甲基丙烯酸甲酯單體)、溶出試驗(甲醛)、材質試驗(2-巯基咪唑啉)、溶出試驗(蒸發殘渣)、溶出試驗(氯乙烯單體)、溶出試驗(己內醯胺單體)、溶出試驗(氯仿可溶物)、溶出試驗(酚)、溶出試驗(以Pb計)、溶出試驗(砷)、溶出試驗(鋅)、砷之檢驗(以As計)、溶出試驗(銻、鍺)、材質試驗(鋇)、材質鑑別、材質試驗(螢光增白劑-遷移性螢光物質試驗)、耐熱性試驗、溶出試驗(三聚氰胺)、溶出試驗(總乳酸)、溶出試驗(著色劑)、材質試驗(氯乙烯單體)、材質試驗(二丁錫化物)、材質試驗(甲酚磷酸酯)、材質試驗(苯乙烯、甲苯、乙苯、正丙苯、異丙苯)、材質試驗(偏二氯乙烯單體)、溶出試驗(氯甲代環氧丙烷單體)、溶出試驗(氯乙烯單體)、溶出試驗(BBP、DEHA、DINP、DIDP),衛生福利部103年06月27日部授食字第1031103054號,http://www.fda.gov.tw/TC/includes/GetFile.ashx?mID=133&id=30375&chk=2ab0a1ab-b6ff-44b5-8a6d-2a8fade5e7a0,http://www.fda.gov.tw/TC/includes/GetFile.ashx?mID=133&id=5729&chk=4ceb52c2-b180-4f3b-b15c-8bd710fdcde7
031,統一企業股份有限公司(新市品管課),74443台南市新市區大營里7號,(06) 599-1511,http://www.uni-president.com.tw/,102.11.22,生菌數、大腸桿菌、大腸桿菌群、乳酸菌,衛生福利部食品藥物管理署102年11月22日部授食字第10211511398號,http://172.16.0.45/upload/133/2013112715413371141.pdf,http://www.fda.gov.tw/TC/includes/GetFile.ashx?mID=133&id=18100&chk=254a0467-c00d-47d1-81c9-3250ea5a2f3d
032,美和科技大學(農水產品檢驗服務中心),91202屏東縣內埔鄉美和村屏光路23號,(08) 779-9821,http://203.71.232.55/meihobt/main.htm,103.09.24,著色劑、甜味劑、孔雀綠及其代謝物、甲基汞、棒麴毒素、黃麴毒素、橘黴素、丙酸、三聚氰胺、三聚氰酸、四環黴素類、亞硝酸鹽、過氧化氫、二氧化硫(食品)、甲醛、氯黴素類、赭麴毒素A、乙型受體素類、防腐劑、硝基呋喃代謝物、3-單氯丙二醇,衛生福利部103年09月24日部授食字第1031102052號,http://www.fda.gov.tw/TC/includes/GetFile.ashx?mID=133&id=31657&chk=42ab20ed-2083-435f-800e-527ee0b45c31,http://www.fda.gov.tw/TC/includes/GetFile.ashx?mID=133&id=31658&chk=4dd064b3-7226-434f-b19d-e11cc57643ce
033,台灣檢驗科技股份有限公司(食品實驗室-台中),40755台中市台中工業區14路9號,(04) 2359-1515,http://www.tw.sgs.com/zh_tw/home_tw_v2?,103.05.05,生菌數、大腸桿菌、大腸桿菌群、水分、灰分、粗脂肪、粗蛋白、防腐劑、順丁烯二酸,衛生福利部食品藥物管理署103年05月05日部授食字第1031102048號,http://www.fda.gov.tw/TC/includes/GetFile.ashx?mID=133&id=29644&chk=8ea2468b-257c-4200-ab52-ed7837f530ff,http://www.fda.gov.tw/TC/includes/GetFile.ashx?mID=133&id=5179&chk=fe470d6d-6356-4bd4-b4d3-a143839084f9
034,國立屏東科技大學(農水產品檢驗與驗證中心),91201屏東縣內埔鄉學府路1號,(08) 774-0219,http://www.caapic.npust.edu.tw/Index/news.asp,103.05.01,水分、粗灰分、粗脂肪、粗蛋白、生菌數、大腸桿菌、硝基呋喃代謝物、孔雀綠及其代謝物、氯黴素類、三聚氰胺、殘留農藥-(二)、(四)、四環黴素類、順丁烯二酸、大腸桿菌群,衛生福利部103年05月01日部授食字第1031102045號,http://www.fda.gov.tw/TC/includes/GetFile.ashx?mID=133&id=29575&chk=b3cd2501-0796-49ec-ad24-98c0e64a3bbf,http://www.fda.gov.tw/TC/includes/GetFile.ashx?mID=133&id=5972&chk=606a258f-726a-403a-812f-39f64df2bde1
035,義美食品股份有限公司(義美食品股份有限公司實驗室),33855桃園縣蘆竹鄉南工路一段11號,(03) 322-2406,http://www.imeifoods.com.tw/,104.01.13,水分、粗灰分、粗蛋白、乳脂肪、三聚氰胺、丙酸、防腐劑、生菌數、大腸桿菌群、大腸桿菌、硼酸及其鹽類、乳酸菌、食品中脂肪酸、乙型受體素類、塑化劑、順丁烯二酸,衛生福利部104年01月13日部授食字第1041100082B號,http://www.fda.gov.tw/TC/includes/GetFile.ashx?mID=133&id=33928&chk=c53d4c6a-a164-46ab-bbab-c8a98970202e,http://www.fda.gov.tw/TC/includes/GetFile.ashx?mID=133&id=18118&chk=f8335662-4082-412d-875b-b5a91e79e1f5
037,宜蘭縣政府衛生局(檢驗科實驗室),26051 宜蘭縣宜蘭市女中路二段287號,(039) 322-634,http://www.ilshb.gov.tw/,103.09.24,大腸桿菌、二氧化硫(食品)、防腐劑、生菌數、大腸桿菌群、硼酸及其鹽類、過氧化氫、甜味劑、金黃色葡萄球菌、殘留農藥-(二)、(四),衛生福利部食品藥物管理署 103年09月24日部授食字第1031104671號,http://www.fda.gov.tw/TC/includes/GetFile.ashx?mID=133&id=31654&chk=f740588d-4d16-47bf-a1df-85a133d70461,http://www.fda.gov.tw/TC/includes/GetFile.ashx?mID=133&id=28115&chk=7da8375f-9f4b-4bcc-a9e2-da4a736f45ba
038,新竹縣政府衛生局(檢驗科實驗室),30295 新竹縣竹北市光明七街1號,(035)518-160,http://www.hcshb.gov.tw/index.jsp,103.11.21,丙酸、生菌數、大腸桿菌、大腸桿菌群、防腐劑,衛生福利部食品藥物管理署 103年11月21日部授食字第1031105844號,http://www.fda.gov.tw/TC/includes/GetFile.ashx?mID=133&id=32948&chk=77e2d968-045f-4683-9527-52a1b5e7ac2f,http://www.fda.gov.tw/TC/includes/GetFile.ashx?mID=133&id=22513&chk=e7acd156-4caa-451d-89d0-3cfacbcf63cd
039,臺東縣衛生局(食品藥政及檢驗科實驗室),95049台東縣台東市博愛路336號,(089) 323-370,http://www.ttshb.gov.tw/,103.12.30,過氧化氫、甲醛、抗氧化劑、防腐劑、硼酸及其鹽類,衛生福利部103年12月30日部授食字第1031106608號,http://www.fda.gov.tw/TC/includes/GetFile.ashx?mID=133&id=33665&chk=ba392e1c-a704-48c2-89d8-f8a491bb6153,http://www.fda.gov.tw/TC/includes/GetFile.ashx?mID=133&id=27701&chk=1092b979-c0d6-44fa-a050-95ea6ed51211
040,嘉義縣衛生局(檢驗科實驗室),61249嘉義縣太保市祥和二路東段3號,(05) 3620-609,http://www.cyshb.gov.tw/main.asp,104.01.09,硼酸及其鹽類、過氧化氫(食品)、亞硝酸鹽、防腐劑、包裝飲用水中重金屬(銅、鋅、砷、鉛、鎘、汞)、四環黴素類、甜味劑,衛生福利部104年01月09日部授食字第1031106610號,http://www.fda.gov.tw/TC/includes/GetFile.ashx?mID=133&id=33876&chk=84bb8e74-9c24-49a2-9299-735074823ac5,http://www.fda.gov.tw/TC/includes/GetFile.ashx?mID=133&id=28116&chk=1c130ab0-0cd5-42f0-a1bf-0f6713ba4000
